{
  "N": 4,
  "batch_id": "2026-07-18--official-grok",
  "config_id": "grok-4.5-eff-high--api--official--dev",
  "positions": [
    {
      "attempts": [
        {
          "attempt_index": 0,
          "backoff_ms": null,
          "charged": true,
          "ended_at": "2026-07-17T15:08:42.571994+00:00",
          "http_status": 200,
          "outcome": "valid",
          "reached_model": true,
          "reason": "ok",
          "request_id": null,
          "started_at": "2026-07-17T15:08:15.882599+00:00"
        }
      ],
      "block_index": 0,
      "model_reaching_attempt_index": 0,
      "slot_index": 0,
      "terminal_state": "valid",
      "variant": "P-min"
    },
    {
      "attempts": [
        {
          "attempt_index": 0,
          "backoff_ms": null,
          "charged": true,
          "ended_at": "2026-07-17T15:09:30.941338+00:00",
          "http_status": 200,
          "outcome": "valid",
          "reached_model": true,
          "reason": "ok",
          "request_id": null,
          "started_at": "2026-07-17T15:08:46.184739+00:00"
        }
      ],
      "block_index": 0,
      "model_reaching_attempt_index": 0,
      "slot_index": 0,
      "terminal_state": "valid",
      "variant": "P-q"
    },
    {
      "attempts": [
        {
          "attempt_index": 0,
          "backoff_ms": null,
          "charged": true,
          "ended_at": "2026-07-17T15:10:24.932451+00:00",
          "http_status": 200,
          "outcome": "valid",
          "reached_model": true,
          "reason": "ok",
          "request_id": null,
          "started_at": "2026-07-17T15:09:34.886319+00:00"
        }
      ],
      "block_index": 1,
      "model_reaching_attempt_index": 0,
      "slot_index": 1,
      "terminal_state": "valid",
      "variant": "P-q"
    },
    {
      "attempts": [
        {
          "attempt_index": 0,
          "backoff_ms": null,
          "charged": true,
          "ended_at": "2026-07-17T15:10:56.526508+00:00",
          "http_status": 200,
          "outcome": "valid",
          "reached_model": true,
          "reason": "ok",
          "request_id": null,
          "started_at": "2026-07-17T15:10:28.785395+00:00"
        }
      ],
      "block_index": 1,
      "model_reaching_attempt_index": 0,
      "slot_index": 1,
      "terminal_state": "valid",
      "variant": "P-min"
    },
    {
      "attempts": [
        {
          "attempt_index": 0,
          "backoff_ms": null,
          "charged": true,
          "ended_at": "2026-07-17T15:11:28.369842+00:00",
          "http_status": 200,
          "outcome": "valid",
          "reached_model": true,
          "reason": "ok",
          "request_id": null,
          "started_at": "2026-07-17T15:11:00.289384+00:00"
        }
      ],
      "block_index": 2,
      "model_reaching_attempt_index": 0,
      "slot_index": 2,
      "terminal_state": "valid",
      "variant": "P-min"
    },
    {
      "attempts": [
        {
          "attempt_index": 0,
          "backoff_ms": null,
          "charged": true,
          "ended_at": "2026-07-17T15:12:39.991821+00:00",
          "http_status": 200,
          "outcome": "valid",
          "reached_model": true,
          "reason": "ok",
          "request_id": null,
          "started_at": "2026-07-17T15:11:31.990647+00:00"
        }
      ],
      "block_index": 2,
      "model_reaching_attempt_index": 0,
      "slot_index": 2,
      "terminal_state": "valid",
      "variant": "P-q"
    },
    {
      "attempts": [
        {
          "attempt_index": 0,
          "backoff_ms": null,
          "charged": true,
          "ended_at": "2026-07-17T15:13:31.825372+00:00",
          "http_status": 200,
          "outcome": "valid",
          "reached_model": true,
          "reason": "ok",
          "request_id": null,
          "started_at": "2026-07-17T15:12:43.911061+00:00"
        }
      ],
      "block_index": 3,
      "model_reaching_attempt_index": 0,
      "slot_index": 3,
      "terminal_state": "valid",
      "variant": "P-q"
    },
    {
      "attempts": [
        {
          "attempt_index": 0,
          "backoff_ms": null,
          "charged": true,
          "ended_at": "2026-07-17T15:14:06.653993+00:00",
          "http_status": 200,
          "outcome": "valid",
          "reached_model": true,
          "reason": "ok",
          "request_id": null,
          "started_at": "2026-07-17T15:13:35.517892+00:00"
        }
      ],
      "block_index": 3,
      "model_reaching_attempt_index": 0,
      "slot_index": 3,
      "terminal_state": "valid",
      "variant": "P-min"
    }
  ],
  "retry_policy": {
    "max_unreachable_retries": 5,
    "rate_limit_backoff": {
      "max_attempts": 4,
      "max_total_ms": 60000
    }
  }
}
